Query,Rank,SimilarityScore,SourceFile,Excerpt,Alignment
how to find roots of a polynomial in scipy,1,0.9239416122,/content/drive/MyDrive/DSF/Lab 2/scipy-main/doc/source/release/1.2.3-notes.rst,"""========================== SciPy 1.2.3 Release Partially irrelevanttes ========================== .. contents:: SciPy 1.2.3 is a bug-fix release with no new features compared to 1.2.2. It is part of the long-term support (LTS) release series for Python 2.7. Authors ==...""",Partially irrelevant
sparse matrix multiplication efficiency,1,0.788279891,/content/drive/MyDrive/DSF/Lab 2/scipy-main/doc/source/reference/sparse.migration_to_sparray.rst,.. _migration_to_sparray: Migration from spmatrix to sparray ================================== This document provides guidance for converting code from sparse *matrices* to sparse *arrays* in ``scipy.sparse``. The change from sparse matrices to spar...,Yes
using curve_fit for non-linear regression,1,1.062904358,/content/drive/MyDrive/DSF/Lab 2/scipy-main/doc/source/tutorial/interpolate/smoothing_splines.rst,".. _tutorial-interpolate_fitpack: .. currentmodule:: scipy.interpolate ================= Smoothing splines ================= Spline smoothing in 1D ====================== For the interpolation problem, the task is to construct a curve which passes th...",relevant
scipy stats distributions,1,0.5676037669,/content/drive/MyDrive/DSF/Lab 2/scipy-main/doc/source/release/1.9.0-notes.rst,"of pdf and cdf calculation. More information can be found in the documentation here (to be linked). - Added `scipy.stats.fit` for fitting discrete and continuous distributions to data. - The methods ``""pearson""`` and ``""tippet""`` from `scipy.stats.co...",relevant
scipy.spatial?,1,0.982618928,/content/drive/MyDrive/DSF/Lab 2/scipy-main/doc/source/reference/spatial.distance.rst,.. automodule:: scipy.spatial.distance :no-members: :no-inherited-members: :no-special-members:...,relevant
understanding scipy optimizashun methods,1,0.6421540976,/content/drive/MyDrive/DSF/Lab 2/scipy-main/doc/source/tutorial/optimize.rst,Optimization (:mod:`scipy.optimize`) ==================================== .. sectionauthor:: Travis E. Oliphant .. sectionauthor:: Pauli Virtanen .. sectionauthor:: Denis Laxalde .. currentmodule:: scipy.optimize .. contents:: The :mod:`scipy.optimiz...,relevant